[
  {
    "type": "prm/LedgerEntry/v1",
    "accountId": "prm:s2nfbcv7jr5kcf3yopfs5dlrqa",
    "sequence": 0,
    "previousEntryHash": null,
    "recorded": "2026-09-15T17:00:00Z",
    "entryType": "key.event",
    "subjectHash": "uEiCWmlCKv0x6oRd4c8sujXGAHMGIESmnmHdAh7hr4bFZcQ",
    "proof": {
      "type": "DataIntegrityProof",
      "cryptosuite": "eddsa-jcs-2022",
      "created": "2026-09-15T17:00:00Z",
      "verificationMethod": "did:key:z6MkfCwPTWq3SKbw4AVj7j8t8oFBiFp6CvZiTnXAw24nVkLH#z6MkfCwPTWq3SKbw4AVj7j8t8oFBiFp6CvZiTnXAw24nVkLH",
      "proofPurpose": "assertionMethod",
      "proofValue": "z43ZRUvcks2uqywsiX9dDDhU2um32fiUP18q99YhzwgfBMj3v7kdBUiYi6jjeJiPL1eBnj1qisB2MYde2QfBaAqep"
    },
    "logInclusion": {
      "logId": "prm-log-example",
      "leafIndex": 0,
      "treeSize": 5,
      "rootHash": "uEiDjVe5V7gOe3b3tnLBpMbV714jR6CiztaTFxqJJJkWuxw",
      "inclusionProof": [
        "uEiAITOKq0FWpxtPtHg8sEfwj5zX1PNKk_5T2col0gWDNYQ",
        "uEiCURvcoMGl5vDaqYr0RR7j7mU3wlLabOMjoUeDvv_Xr-g",
        "uEiANlHN27yyP4Axl_4-5DCKtkFpxiMGzavAA8ybJOxLRTg"
      ]
    }
  },
  {
    "type": "prm/LedgerEntry/v1",
    "accountId": "prm:s2nfbcv7jr5kcf3yopfs5dlrqa",
    "sequence": 1,
    "previousEntryHash": "uEiCOt_OnN2EhSgAEcSGXkD53P2QRUMVLX3CadsVFGMWZJQ",
    "recorded": "2026-09-15T17:00:00Z",
    "entryType": "policy.published",
    "subjectHash": "uEiCCVYqo5goptwm4lS1RN_8WgOwJ5A8un4JTasreIyS9JA",
    "proof": {
      "type": "DataIntegrityProof",
      "cryptosuite": "eddsa-jcs-2022",
      "created": "2026-09-15T17:00:00Z",
      "verificationMethod": "did:key:z6MkfCwPTWq3SKbw4AVj7j8t8oFBiFp6CvZiTnXAw24nVkLH#z6MkfCwPTWq3SKbw4AVj7j8t8oFBiFp6CvZiTnXAw24nVkLH",
      "proofPurpose": "assertionMethod",
      "proofValue": "z2LrfsTqkHAg1ijobpdMFqC4VodpqDvfSPsYKoDEDve1bXxNojVSJYdUE3CwW2RpGvKhFT2pk32YCFs2DLU4SzHhY"
    },
    "logInclusion": {
      "logId": "prm-log-example",
      "leafIndex": 1,
      "treeSize": 5,
      "rootHash": "uEiDjVe5V7gOe3b3tnLBpMbV714jR6CiztaTFxqJJJkWuxw",
      "inclusionProof": [
        "uEiBagRdaDXTuCGfRyl6tVXkeh6JB1Klv0FIjx5TE8tdjrQ",
        "uEiCURvcoMGl5vDaqYr0RR7j7mU3wlLabOMjoUeDvv_Xr-g",
        "uEiANlHN27yyP4Axl_4-5DCKtkFpxiMGzavAA8ybJOxLRTg"
      ]
    }
  },
  {
    "type": "prm/LedgerEntry/v1",
    "accountId": "prm:s2nfbcv7jr5kcf3yopfs5dlrqa",
    "sequence": 2,
    "previousEntryHash": "uEiAqH8Civ26gI5nnXPqZ3pTQlTWNP-C1IbxyWYZkEflZqw",
    "recorded": "2026-09-16T16:00:00Z",
    "entryType": "notice.sent",
    "subjectHash": "uEiCdCHZYExhJvMaDsQx-ZX1JdRTH-D79MM5EgKQp4rKXdw",
    "counterparty": {
      "name": "City of Whittier Police Department",
      "id": "did:web:whittierpd.org",
      "channel": "postal"
    },
    "evidence": [
      {
        "kind": "certified-mail-receipt",
        "digest": "uEiATksmliU-6buwoSTkB_5DGHxQP0PVt4Rf5olBqdNhO7Q",
        "note": "USPS Certified Mail, return receipt requested (tracking recorded locally)"
      }
    ],
    "proof": {
      "type": "DataIntegrityProof",
      "cryptosuite": "eddsa-jcs-2022",
      "created": "2026-09-16T16:00:00Z",
      "verificationMethod": "did:key:z6MkfCwPTWq3SKbw4AVj7j8t8oFBiFp6CvZiTnXAw24nVkLH#z6MkfCwPTWq3SKbw4AVj7j8t8oFBiFp6CvZiTnXAw24nVkLH",
      "proofPurpose": "assertionMethod",
      "proofValue": "z288Np26hpRPx2URAWbancyuePxYMtsixA6hW7wv6hyrZ9azG6hXVYFKyqDzSJ53SsSxCt47vFJNBJ8hDMP1QgxnK"
    },
    "logInclusion": {
      "logId": "prm-log-example",
      "leafIndex": 2,
      "treeSize": 5,
      "rootHash": "uEiDjVe5V7gOe3b3tnLBpMbV714jR6CiztaTFxqJJJkWuxw",
      "inclusionProof": [
        "uEiDcx_NkIUn5nXRrcp1OhB0EJdljl_cm83mgqqvq6L-PBw",
        "uEiCTcCisPHvGEKo0zlBQgIeYkWkregiuxvc5iiyBX-mbzw",
        "uEiANlHN27yyP4Axl_4-5DCKtkFpxiMGzavAA8ybJOxLRTg"
      ]
    }
  },
  {
    "type": "prm/LedgerEntry/v1",
    "accountId": "prm:s2nfbcv7jr5kcf3yopfs5dlrqa",
    "sequence": 3,
    "previousEntryHash": "uEiBQIhPEUpf0lX3QFOW8JQbrKBa1A7Y8dMTxpqvXkYqJEg",
    "recorded": "2026-09-16T16:05:00Z",
    "entryType": "notice.sent",
    "subjectHash": "uEiCdCHZYExhJvMaDsQx-ZX1JdRTH-D79MM5EgKQp4rKXdw",
    "counterparty": {
      "name": "ALPR system vendor (as identified in the agency contract)",
      "id": "did:web:example-alpr-vendor.com",
      "channel": "email"
    },
    "evidence": [
      {
        "kind": "smtp-receipt",
        "digest": "uEiBnyHAnxLd_POkclner2oGudAwBClRceRQW-1feCwviiA",
        "note": "Raw .eml with DKIM headers preserved locally"
      }
    ],
    "proof": {
      "type": "DataIntegrityProof",
      "cryptosuite": "eddsa-jcs-2022",
      "created": "2026-09-16T16:05:00Z",
      "verificationMethod": "did:key:z6MkfCwPTWq3SKbw4AVj7j8t8oFBiFp6CvZiTnXAw24nVkLH#z6MkfCwPTWq3SKbw4AVj7j8t8oFBiFp6CvZiTnXAw24nVkLH",
      "proofPurpose": "assertionMethod",
      "proofValue": "z4tnDdgKAiyQCTKuSNgWT3TXcApuSyLR5m8CAmzFbs1kmZ3pPMd1gJCfB6Xurdqr1rETV2Vafys1L4FTYMCJTTrEg"
    },
    "logInclusion": {
      "logId": "prm-log-example",
      "leafIndex": 3,
      "treeSize": 5,
      "rootHash": "uEiDjVe5V7gOe3b3tnLBpMbV714jR6CiztaTFxqJJJkWuxw",
      "inclusionProof": [
        "uEiC0b5ub1hV6LKmA9IPLuzP2w5EmF9T-h19UTGJV3IknNA",
        "uEiCTcCisPHvGEKo0zlBQgIeYkWkregiuxvc5iiyBX-mbzw",
        "uEiANlHN27yyP4Axl_4-5DCKtkFpxiMGzavAA8ybJOxLRTg"
      ]
    }
  },
  {
    "type": "prm/LedgerEntry/v1",
    "accountId": "prm:s2nfbcv7jr5kcf3yopfs5dlrqa",
    "sequence": 4,
    "previousEntryHash": "uEiCHvFWwFvy2-4uIkaEnl0XDQgLa8eT13G6Gycw_xV1oZQ",
    "recorded": "2026-09-16T16:10:00Z",
    "entryType": "request.access",
    "subjectHash": "uEiC6utvM65BshxaQ9ukpLbZo8tfmlyBswEX0dhJO5y-0wg",
    "counterparty": {
      "name": "City of Whittier Police Department",
      "id": "did:web:whittierpd.org",
      "channel": "postal"
    },
    "proof": {
      "type": "DataIntegrityProof",
      "cryptosuite": "eddsa-jcs-2022",
      "created": "2026-09-16T16:10:00Z",
      "verificationMethod": "did:key:z6MkfCwPTWq3SKbw4AVj7j8t8oFBiFp6CvZiTnXAw24nVkLH#z6MkfCwPTWq3SKbw4AVj7j8t8oFBiFp6CvZiTnXAw24nVkLH",
      "proofPurpose": "assertionMethod",
      "proofValue": "z4DPHsPtAqmVN9VwkaeiyJ79UaHGmP2k71NHKycYLZwfb67oW7T9cLujx7mtVM7rYMvkB2MAxVgnuHry9n2t9iHB3"
    },
    "logInclusion": {
      "logId": "prm-log-example",
      "leafIndex": 4,
      "treeSize": 5,
      "rootHash": "uEiDjVe5V7gOe3b3tnLBpMbV714jR6CiztaTFxqJJJkWuxw",
      "inclusionProof": [
        "uEiBOpFHgBEiEShlpm-jyQY21cyCOimpWrdmrr18txLDtPw"
      ]
    }
  }
]
