[
  {
    "type": "prm/LedgerEntry/v1",
    "accountId": "prm:737vmx23g2dbf2yy66qr2ta4a2",
    "sequence": 0,
    "previousEntryHash": null,
    "recorded": "2026-09-06T14:02:12Z",
    "entryType": "key.event",
    "subjectHash": "uEiD-_1ZfWzaGEusY96EdTBwGudBdM5BYI2zz_Y9rlSg21g",
    "proof": {
      "type": "DataIntegrityProof",
      "cryptosuite": "eddsa-jcs-2022",
      "created": "2026-09-06T14:02:12Z",
      "verificationMethod": "did:key:z6MkrXkKJa4ytWRY9ZtJXK3k3o9dsrLdKYC5vhRbZjZfu4Zo#z6MkrXkKJa4ytWRY9ZtJXK3k3o9dsrLdKYC5vhRbZjZfu4Zo",
      "proofPurpose": "assertionMethod",
      "proofValue": "z4PPz8tZ9Xkxn5tvnZMQETa7ijHGtQR58g8DjYYRyWXZ7aKcwM1GrxsiBg1Rok6rxKweFomAsMT5or9T3PUHGpC7H"
    }
  },
  {
    "type": "prm/LedgerEntry/v1",
    "accountId": "prm:737vmx23g2dbf2yy66qr2ta4a2",
    "sequence": 1,
    "previousEntryHash": "uEiDlg2jfDaYJAtJaQ0R-EqHS9_bp5YXPPQXF8nG_EgF-Bw",
    "recorded": "2026-09-06T14:07:35Z",
    "entryType": "policy.published",
    "subjectHash": "uEiAJFWRm-OkVHft16L4qNeHrUEpFnU4JOC_3HdBesnKQkQ",
    "proof": {
      "type": "DataIntegrityProof",
      "cryptosuite": "eddsa-jcs-2022",
      "created": "2026-09-06T14:07:35Z",
      "verificationMethod": "did:key:z6MkrXkKJa4ytWRY9ZtJXK3k3o9dsrLdKYC5vhRbZjZfu4Zo#z6MkrXkKJa4ytWRY9ZtJXK3k3o9dsrLdKYC5vhRbZjZfu4Zo",
      "proofPurpose": "assertionMethod",
      "proofValue": "z5Ymf7CZkGd4X9nifsQfyUZJZRQUrnGNHxxWhiWPCMnQ5TdPyujqQXrjNdgiNMPTZSfGhCDpsaMAAGsuyFgR6nz4z"
    },
    "logInclusion": {
      "logId": "prm-log-1",
      "leafIndex": 1,
      "treeSize": 6,
      "rootHash": "uEiAQqD0id5b7ESdDn8Tfazlcj9Jor8E1nSP0YXET6MtQOw",
      "inclusionProof": [
        "uEiDsgurbbQKaOiTiAa83zKojMMq5-6PMFyi-j2ml4hwRMw",
        "uEiDPFQns1gPgVbpPACHgvDmsShcBAdGxUv3qjJnDQV11rw",
        "uEiBmuWj375KQco8TeGUO0YB8LKV6Rd5TwkeMTugP641mzQ"
      ],
      "signedTreeHead": "<detached JWS — see spec/examples/ledger/signed-tree-head.json>"
    }
  },
  {
    "type": "prm/LedgerEntry/v1",
    "accountId": "prm:737vmx23g2dbf2yy66qr2ta4a2",
    "sequence": 2,
    "previousEntryHash": "uEiCW8jwfgPfQ-Uj2we1ZfMkxwD216t_tarDDqCU6HNe4DQ",
    "recorded": "2026-09-12T09:30:00Z",
    "entryType": "notice.sent",
    "subjectHash": "uEiDHxLo-fBbKJYjjxeAtNkRERutlTL2zRm_ohpiBGKmVGA",
    "counterparty": {
      "name": "Example Data Controller",
      "id": "did:web:example.org",
      "channel": "postal"
    },
    "evidence": [
      {
        "kind": "certified-mail-receipt",
        "digest": "uEiBcjdQPIUYBB-pOcQiCqK5xr1gOxvwd8WNYNCRuXJ94pw",
        "note": "Synthetic delivery receipt reference"
      }
    ],
    "proof": {
      "type": "DataIntegrityProof",
      "cryptosuite": "eddsa-jcs-2022",
      "created": "2026-09-12T09:30:00Z",
      "verificationMethod": "did:key:z6MkrXkKJa4ytWRY9ZtJXK3k3o9dsrLdKYC5vhRbZjZfu4Zo#z6MkrXkKJa4ytWRY9ZtJXK3k3o9dsrLdKYC5vhRbZjZfu4Zo",
      "proofPurpose": "assertionMethod",
      "proofValue": "z2UyPrDfQo72XVqEK4FnrzWCpNK4UxTzkvpSpLVfZjLSbNSzeMPs45KebCDsggmXL2Tn2TStPBkdY67ELkqvHkspA"
    }
  },
  {
    "type": "prm/LedgerEntry/v1",
    "accountId": "prm:737vmx23g2dbf2yy66qr2ta4a2",
    "sequence": 3,
    "previousEntryHash": "uEiAccmTniDWb8L5mBkVUmo8pRlB9E4cc-XlXAgRgLzJurA",
    "recorded": "2026-09-16T00:00:00Z",
    "entryType": "notice.delivered",
    "subjectHash": "uEiDHxLo-fBbKJYjjxeAtNkRERutlTL2zRm_ohpiBGKmVGA",
    "counterparty": {
      "name": "Example Data Controller",
      "id": "did:web:example.org",
      "channel": "postal"
    },
    "evidence": [
      {
        "kind": "usps-tracking",
        "digest": "uEiARm4A8jWcMf7azBUF0hjNDFpVQ9Hki8ixhgp0xz6ao4w"
      }
    ],
    "proof": {
      "type": "DataIntegrityProof",
      "cryptosuite": "eddsa-jcs-2022",
      "created": "2026-09-16T00:00:00Z",
      "verificationMethod": "did:key:z6MkrXkKJa4ytWRY9ZtJXK3k3o9dsrLdKYC5vhRbZjZfu4Zo#z6MkrXkKJa4ytWRY9ZtJXK3k3o9dsrLdKYC5vhRbZjZfu4Zo",
      "proofPurpose": "assertionMethod",
      "proofValue": "zxk1xhdCoj9zn7gxMqeEdJ9bv2yzYmMDSR6f6RoRf7C67bTkxgRQ33VWEynCsLEoye6LQnEZNFf8LeDrRCWznGLd"
    }
  },
  {
    "type": "prm/LedgerEntry/v1",
    "accountId": "prm:737vmx23g2dbf2yy66qr2ta4a2",
    "sequence": 4,
    "previousEntryHash": "uEiDBtPFSsmlqVnRd4PYZlBVoaDwlDyumCeiyW4GgfXcSvQ",
    "recorded": "2026-11-02T10:15:02Z",
    "entryType": "policy.published",
    "subjectHash": "uEiBwanjk0uwUmEPptghaWNpZ8BdT5rBnAZi1iBfOq2pyig",
    "proof": {
      "type": "DataIntegrityProof",
      "cryptosuite": "eddsa-jcs-2022",
      "created": "2026-11-02T10:15:02Z",
      "verificationMethod": "did:key:z6MkrXkKJa4ytWRY9ZtJXK3k3o9dsrLdKYC5vhRbZjZfu4Zo#z6MkrXkKJa4ytWRY9ZtJXK3k3o9dsrLdKYC5vhRbZjZfu4Zo",
      "proofPurpose": "assertionMethod",
      "proofValue": "z4gF5chb9ynm1htT7VF2szLm23aqjFGxUoZvQi69Nwrm4fVKmD5ZMZgTaFgvPgUXM7ctBezbkbQTWkmB14YLFEpwc"
    },
    "logInclusion": {
      "logId": "prm-log-1",
      "leafIndex": 4,
      "treeSize": 6,
      "rootHash": "uEiAQqD0id5b7ESdDn8Tfazlcj9Jor8E1nSP0YXET6MtQOw",
      "inclusionProof": [
        "uEiACZUrIS9B8D3-x4h3CdzNCKwGB6GJYBmt5sW2ZOo7a7Q",
        "uEiDoklWWTDFFKFnGcIYJMvidZOIT1G3R6NhFzOOFewjjQw"
      ],
      "signedTreeHead": "<detached JWS — see spec/examples/ledger/signed-tree-head.json>"
    }
  },
  {
    "type": "prm/LedgerEntry/v1",
    "accountId": "prm:737vmx23g2dbf2yy66qr2ta4a2",
    "sequence": 5,
    "previousEntryHash": "uEiD6PXTrPwq2o-_zUB4G9wJd0s11-kscGmlHCnrUGOiOcA",
    "recorded": "2026-11-20T00:00:03Z",
    "entryType": "authorization.granted",
    "subjectHash": "uEiBqsFmVEmKWPHJOjWF9MKUvaYGixeQ0hVPrkNmSeAT5Ow",
    "counterparty": {
      "name": "Example Data Controller",
      "id": "did:web:example.org",
      "channel": "email"
    },
    "proof": {
      "type": "DataIntegrityProof",
      "cryptosuite": "eddsa-jcs-2022",
      "created": "2026-11-20T00:00:03Z",
      "verificationMethod": "did:key:z6MkrXkKJa4ytWRY9ZtJXK3k3o9dsrLdKYC5vhRbZjZfu4Zo#z6MkrXkKJa4ytWRY9ZtJXK3k3o9dsrLdKYC5vhRbZjZfu4Zo",
      "proofPurpose": "assertionMethod",
      "proofValue": "z4mwiLniYFn343Ej3LQSfwj3EqteW5pUajssPVyms2VksKroCN3jzQSJMfZnsPML9QeEdbn4b2gdj7FNkMiMkyXCd"
    }
  }
]
